{
  "languagePack": {
    "id": "montenegrin-en",
    "targetLanguage": {
      "code": "cnr",
      "name": "Montenegrin",
      "scripts": [
        "Latn",
        "Cyrl"
      ]
    },
    "supportLanguage": {
      "code": "en",
      "name": "English"
    },
    "version": "0.1.0",
    "status": "draft",
    "direction": "ltr",
    "defaultScript": "Latn",
    "locale": "cnr"
  },
  "curriculum": {
    "months": [
      [
        "family",
        "greetings",
        "numbers"
      ],
      [
        "colors",
        "drinks",
        "food"
      ],
      [
        "veg",
        "cafe",
        "talkfamily"
      ],
      [
        "aboutme",
        "days",
        "outabout"
      ],
      [
        "weather",
        "emotions",
        "house"
      ],
      [
        "clothes",
        "body",
        "shopping"
      ],
      [
        "directions",
        "beach",
        "time"
      ],
      [
        "hobbies",
        "travel",
        "verbs1"
      ],
      [
        "adjectives",
        "questionwords",
        "plans"
      ],
      [
        "smalltalk",
        "restaurant",
        "gathering"
      ]
    ],
    "extras": [
      "pasttense",
      "futuretense",
      "capstone"
    ]
  },
  "topics": [
    {
      "id": "family",
      "month": 1,
      "title": "Family",
      "subtitle": "Words for relatives",
      "icon": "Fa",
      "color": "#7dd3fc",
      "note": "Your family speaks a Montenegrin-Dalmatian blend — words like dida and kukumar are your family's words, not mistakes. In Montenegrin, grandpa may also be deda.",
      "items": [
        {
          "id": "family-item-001",
          "targetText": "mama",
          "supportText": "mom",
          "emoji": "👩"
        },
        {
          "id": "family-item-002",
          "targetText": "tata",
          "supportText": "dad",
          "emoji": "👨"
        },
        {
          "id": "family-item-003",
          "targetText": "brat",
          "supportText": "brother",
          "emoji": "👦"
        },
        {
          "id": "family-item-004",
          "targetText": "sestra",
          "supportText": "sister",
          "emoji": "👧"
        },
        {
          "id": "family-item-005",
          "targetText": "baba",
          "supportText": "grandma",
          "emoji": "👵"
        },
        {
          "id": "family-item-006",
          "targetText": "dida",
          "supportText": "grandpa (Montenegrin: deda)",
          "emoji": "👴"
        },
        {
          "id": "family-item-007",
          "targetText": "sin",
          "supportText": "son",
          "emoji": "👦"
        },
        {
          "id": "family-item-008",
          "targetText": "kćerka",
          "supportText": "daughter (also: kći)",
          "emoji": "👧"
        },
        {
          "id": "family-item-009",
          "targetText": "porodica",
          "supportText": "family",
          "emoji": "👪"
        },
        {
          "id": "family-item-010",
          "targetText": "roditelji",
          "supportText": "parents"
        },
        {
          "id": "family-item-011",
          "targetText": "dijete / djeca",
          "supportText": "child / children",
          "emoji": "👶"
        },
        {
          "id": "family-item-012",
          "targetText": "ko",
          "supportText": "who"
        }
      ]
    },
    {
      "id": "greetings",
      "month": 1,
      "title": "Greetings",
      "subtitle": "Say hello & introduce yourself",
      "icon": "Zd",
      "color": "#f472b6",
      "items": [
        {
          "id": "greetings-item-001",
          "targetText": "Zdravo",
          "supportText": "Hello"
        },
        {
          "id": "greetings-item-002",
          "targetText": "Dobar dan",
          "supportText": "Good afternoon"
        },
        {
          "id": "greetings-item-003",
          "targetText": "Dobro jutro",
          "supportText": "Good morning"
        },
        {
          "id": "greetings-item-004",
          "targetText": "Hvala",
          "supportText": "Thank you"
        },
        {
          "id": "greetings-item-005",
          "targetText": "Molim",
          "supportText": "Please / You're welcome"
        },
        {
          "id": "greetings-item-006",
          "targetText": "Da",
          "supportText": "Yes"
        },
        {
          "id": "greetings-item-007",
          "targetText": "Ne",
          "supportText": "No"
        },
        {
          "id": "greetings-item-008",
          "targetText": "Doviđenja",
          "supportText": "Goodbye"
        },
        {
          "id": "greetings-item-009",
          "targetText": "Ćao",
          "supportText": "Bye / Hi (informal)"
        },
        {
          "id": "greetings-item-010",
          "targetText": "Izvini",
          "supportText": "Sorry / Excuse me"
        },
        {
          "id": "greetings-item-011",
          "targetText": "Kako se zoveš?",
          "supportText": "What's your name?"
        },
        {
          "id": "greetings-item-012",
          "targetText": "Zovem se...",
          "supportText": "My name is..."
        },
        {
          "id": "greetings-item-013",
          "targetText": "Drago mi je",
          "supportText": "Nice to meet you"
        }
      ],
      "dialogue": {
        "roles": [
          "You",
          "New Friend"
        ],
        "lines": [
          {
            "id": "greetings-dialogue-001",
            "targetText": "Dobar dan! Kako se zoveš?",
            "supportText": "Good afternoon! What is your name?",
            "role": "You"
          },
          {
            "id": "greetings-dialogue-002",
            "targetText": "Zovem se Lena. A ti?",
            "supportText": "My name is Lena. And you?",
            "role": "New Friend"
          },
          {
            "id": "greetings-dialogue-003",
            "targetText": "Zovem se Sam. Drago mi je!",
            "supportText": "My name is Sam. Nice to meet you!",
            "role": "You"
          },
          {
            "id": "greetings-dialogue-004",
            "targetText": "Drago mi je! Doviđenja.",
            "supportText": "Nice to meet you too! Goodbye.",
            "role": "New Friend"
          }
        ]
      },
      "connections": [
        {
          "id": "greetings-family-spiral",
          "requiresTopicIds": [
            "greetings",
            "family"
          ],
          "items": [
            {
              "id": "greetings-conn-001",
              "targetText": "Dobar dan! Ovo je moja porodica.",
              "supportText": "Good day! This is my family."
            }
          ]
        }
      ]
    },
    {
      "id": "numbers",
      "month": 2,
      "title": "Numbers",
      "subtitle": "Counting 1–100",
      "icon": "123",
      "color": "#a3e635",
      "items": [
        {
          "id": "numbers-item-001",
          "targetText": "jedan",
          "supportText": "one (1)"
        },
        {
          "id": "numbers-item-002",
          "targetText": "dva",
          "supportText": "two (2)"
        },
        {
          "id": "numbers-item-003",
          "targetText": "tri",
          "supportText": "three (3)"
        },
        {
          "id": "numbers-item-004",
          "targetText": "četiri",
          "supportText": "four (4)"
        },
        {
          "id": "numbers-item-005",
          "targetText": "pet",
          "supportText": "five (5)"
        },
        {
          "id": "numbers-item-006",
          "targetText": "šest",
          "supportText": "six (6)"
        },
        {
          "id": "numbers-item-007",
          "targetText": "sedam",
          "supportText": "seven (7)"
        },
        {
          "id": "numbers-item-008",
          "targetText": "osam",
          "supportText": "eight (8)"
        },
        {
          "id": "numbers-item-009",
          "targetText": "devet",
          "supportText": "nine (9)"
        },
        {
          "id": "numbers-item-010",
          "targetText": "deset",
          "supportText": "ten (10)"
        },
        {
          "id": "numbers-item-011",
          "targetText": "dvadeset",
          "supportText": "twenty (20)"
        },
        {
          "id": "numbers-item-012",
          "targetText": "trideset",
          "supportText": "thirty (30)"
        },
        {
          "id": "numbers-item-013",
          "targetText": "pedeset",
          "supportText": "fifty (50)"
        },
        {
          "id": "numbers-item-014",
          "targetText": "sto",
          "supportText": "one hundred (100)"
        }
      ],
      "connections": [
        {
          "id": "numbers-family-connection",
          "requiresTopicIds": [
            "family"
          ],
          "items": [
            {
              "id": "connection-numbers-family-001",
              "targetText": "Imam jednog brata.",
              "supportText": "I have one brother.",
              "reviewStatus": "draft"
            },
            {
              "id": "connection-numbers-family-002",
              "targetText": "Imam dva brata.",
              "supportText": "I have two brothers.",
              "reviewStatus": "draft"
            },
            {
              "id": "connection-numbers-family-003",
              "targetText": "Imam tri sestre.",
              "supportText": "I have three sisters.",
              "reviewStatus": "draft"
            },
            {
              "id": "connection-numbers-family-004",
              "targetText": "Imam četiri brata.",
              "supportText": "I have four brothers.",
              "reviewStatus": "draft"
            },
            {
              "id": "connection-numbers-family-005",
              "targetText": "Imam pet sestara.",
              "supportText": "I have five sisters.",
              "reviewStatus": "draft"
            },
            {